{
  "id": "compound.membrane_webhook_boundary_only",
  "name": "Membrane webhook boundary (substrate-only)",
  "schema": "periodic.compound.v1",
  "tables_version": "1",
  "elements": [
    "cap.membrane.webhook_boundary",
    "ev.membrane.interface_spec",
    "pr.membrane.backward_compat",
    "pr.membrane.failure_isolation",
    "wf.membrane.compatibility_tests",
    "wf.membrane.contract_versioning"
  ]
}
