{
  "schema": "periodic.compound.v1",
  "tables_version": "1",
  "id": "compound.crm_lite",
  "name": "CRM lite (accounts + contacts + pipeline stages + audit)",
  "elements": [
    "cap.auth.session",
    "cap.observability.metrics",
    "cap.security.rbac",
    "cap.storage.sql",
    "ev.audit.log_integrity",
    "ev.backup.policy",
    "ev.change.migration_plan",
    "ev.data.constraints",
    "ev.data.schema_versioning",
    "ev.monitor.errors",
    "ev.monitor.latency",
    "ev.monitor.saturation",
    "ev.monitor.traffic",
    "exp.display.activity_log",
    "exp.display.profile",
    "exp.display.table",
    "exp.feedback.modal_confirm",
    "exp.feedback.permission_denied",
    "exp.input.filters",
    "exp.input.form.basic",
    "exp.nav.sidebar",
    "wf.audit.append_only_log",
    "wf.change.migration",
    "wf.ops.backup_restore",
    "wf.pipeline.stage_progression"
  ]
}
