{
  "elements": [
    "cap.identity.reusable_account",
    "ev.auth.login_receipts",
    "ev.auth.session_audit_log",
    "pr.auth.challenge_response_only",
    "pr.auth.no_browser_secrets",
    "wf.auth.session_tokens",
    "wf.auth.wallet_login"
  ],
  "id": "compound.identity_wallet_login",
  "name": "Identity Access: Wallet login + session receipts",
  "schema": "periodic.compound.v1",
  "tables_version": "1"
}
