{
  "elements": [
    "cap.integrations.api_client",
    "cap.observability.metrics",
    "cap.rate_limit",
    "cap.storage.blob",
    "cap.storage.sql",
    "ev.backup.policy",
    "ev.change.migration_plan",
    "ev.data.constraints",
    "ev.data.schema_versioning",
    "ev.monitor.errors",
    "ev.monitor.latency",
    "ev.monitor.saturation",
    "ev.monitor.traffic",
    "ev.resilience.idempotency_key",
    "exp.display.card_grid",
    "exp.feedback.modal_confirm",
    "exp.feedback.retry_banner",
    "exp.flow.checkout",
    "exp.input.file_upload",
    "exp.nav.topbar",
    "exp.value.tx_status",
    "pr.idempotence",
    "wf.change.migration",
    "wf.data.import",
    "wf.ops.backup_restore",
    "wf.resilience.idempotency_key",
    "wf.resilience.retry_backoff",
    "wf.tx.lifecycle"
  ],
  "id": "compound.marketplace_basic",
  "name": "Marketplace basic (checkout + file upload)",
  "schema": "periodic.compound.v1",
  "tables_version": "1"
}
