{
  "schema": "periodic.compound.v1",
  "tables_version": "1",
  "id": "compound.blog_basic_phase2",
  "name": "Blog basic (Phase2: publish with proof receipts)",
  "elements": [
    "cap.auth.session",
    "cap.observability.metrics",
    "cap.search.fulltext",
    "cap.security.rbac",
    "cap.storage.sql",
    "ev.backup.policy",
    "ev.change.migration_plan",
    "ev.data.constraints",
    "ev.data.schema_versioning",
    "ev.monitor.errors",
    "ev.monitor.latency",
    "ev.monitor.saturation",
    "ev.monitor.traffic",
    "ev.proof.build_reproducible",
    "ev.proof.receipts",
    "ev.proof.receipts.sha256_bytes",
    "exp.display.profile",
    "exp.display.table",
    "exp.feedback.permission_denied",
    "exp.flow.publish",
    "exp.input.rich_text",
    "exp.nav.search",
    "exp.nav.sidebar",
    "wf.content.draft_review_publish",
    "wf.ops.backup_restore",
    "wf.proof.verify_receipts"
  ]
}
