{
  "elements": [
    "cap.auth.session",
    "cap.cache.cdn",
    "cap.observability.metrics",
    "cap.security.rbac",
    "cap.storage.blob",
    "cap.storage.sql",
    "ev.backup.policy",
    "ev.change.migration_plan",
    "ev.data.constraints",
    "ev.data.schema_versioning",
    "ev.monitor.errors",
    "ev.monitor.latency",
    "ev.monitor.saturation",
    "ev.monitor.traffic",
    "ev.proof.receipts",
    "exp.display.card_grid",
    "exp.feedback.permission_denied",
    "exp.input.file_upload",
    "wf.ops.backup_restore"
  ],
  "id": "compound.file_upload_media",
  "name": "Media uploads (blob storage + retention)",
  "schema": "periodic.compound.v1",
  "tables_version": "1"
}
